{
  "schema_version": "1.0.0",
  "record_type": "software-package",
  "name": "PyYAML",
  "version": "6.0.3",
  "source_url": "https://github.com/yaml/pyyaml",
  "license": {
    "kind": "spdx",
    "expression": "MIT",
    "classification": "osi-open-source",
    "osi_approved": true,
    "attribution_required": true
  },
  "review": {
    "status": "accepted",
    "decision_by": "study",
    "decision_date": "2026-08-08",
    "notes": "Permissive OSI-approved software license accepted by default."
  }
}
